{
  "$schema": "https://json-schema.org/draft/2020-12/schema",
  "$id": "https://datapass.local/schemas/datapass-board.schema.json",
  "title": "DataPass project board (1)",
  "type": "object",
  "additionalProperties": false,
  "properties": {
    "$schema": {
      "type": "string",
      "maxLength": 500
    },
    "format": {
      "const": "datapass.board"
    },
    "version": {
      "const": "1"
    },
    "title": {
      "type": "string",
      "minLength": 1,
      "maxLength": 200
    },
    "description": {
      "type": "string",
      "minLength": 1,
      "maxLength": 4000
    },
    "updated": {
      "type": "string",
      "pattern": "^\\d{4}-\\d{2}-\\d{2}$"
    },
    "columns": {
      "type": "array",
      "items": {
        "type": "object",
        "additionalProperties": false,
        "properties": {
          "id": {
            "type": "string",
            "pattern": "^[a-z][a-z0-9_.-]{0,79}$"
          },
          "title": {
            "type": "string",
            "minLength": 1,
            "maxLength": 200
          },
          "done": {
            "type": "boolean"
          },
          "limit": {
            "type": "integer",
            "minimum": 1,
            "maximum": 99
          },
          "description": {
            "type": "string",
            "minLength": 1,
            "maxLength": 4000
          }
        },
        "required": [
          "id"
        ]
      },
      "maxItems": 12,
      "minItems": 1
    },
    "sprints": {
      "type": "array",
      "items": {
        "type": "object",
        "additionalProperties": false,
        "properties": {
          "id": {
            "type": "string",
            "pattern": "^[a-z][a-z0-9_.-]{0,79}$"
          },
          "title": {
            "type": "string",
            "minLength": 1,
            "maxLength": 200
          },
          "start": {
            "type": "string",
            "pattern": "^\\d{4}-\\d{2}-\\d{2}$"
          },
          "end": {
            "type": "string",
            "pattern": "^\\d{4}-\\d{2}-\\d{2}$"
          },
          "goal": {
            "type": "string",
            "minLength": 1,
            "maxLength": 4000
          }
        },
        "required": [
          "id",
          "title",
          "start",
          "end"
        ]
      },
      "maxItems": 100,
      "minItems": 0
    },
    "milestones": {
      "type": "array",
      "items": {
        "type": "object",
        "additionalProperties": false,
        "properties": {
          "id": {
            "type": "string",
            "pattern": "^[a-z][a-z0-9_.-]{0,79}$"
          },
          "title": {
            "type": "string",
            "minLength": 1,
            "maxLength": 200
          },
          "due": {
            "type": "string",
            "pattern": "^\\d{4}-\\d{2}-\\d{2}$"
          },
          "description": {
            "type": "string",
            "minLength": 1,
            "maxLength": 4000
          }
        },
        "required": [
          "id",
          "title"
        ]
      },
      "maxItems": 50,
      "minItems": 0
    },
    "items": {
      "type": "array",
      "items": {
        "type": "object",
        "additionalProperties": false,
        "properties": {
          "id": {
            "type": "string",
            "pattern": "^[a-z][a-z0-9_.-]{0,79}$"
          },
          "type": {
            "enum": [
              "task",
              "bug",
              "feature",
              "decision",
              "question"
            ]
          },
          "title": {
            "type": "string",
            "minLength": 1,
            "maxLength": 200
          },
          "status": {
            "type": "string",
            "pattern": "^[a-z][a-z0-9_.-]{0,79}$"
          },
          "priority": {
            "enum": [
              "P0",
              "P1",
              "P2",
              "P3",
              "P4"
            ]
          },
          "description": {
            "type": "string",
            "minLength": 1,
            "maxLength": 4000
          },
          "subproject": {
            "type": "string",
            "pattern": "^[a-z][a-z0-9_.-]{0,79}$"
          },
          "components": {
            "type": "array",
            "items": {
              "type": "string",
              "pattern": "^[a-z][a-z0-9_.-]{0,79}$"
            },
            "maxItems": 30,
            "minItems": 0
          },
          "files": {
            "type": "array",
            "items": {
              "type": "object",
              "additionalProperties": false,
              "properties": {
                "repoRef": {
                  "type": "string",
                  "pattern": "^[a-z][a-z0-9_.-]{0,79}$"
                },
                "path": {
                  "type": "string",
                  "minLength": 1,
                  "maxLength": 400,
                  "pattern": "^(?![/\\\\~])(?![A-Za-z]:)(?!.*(^|[/\\\\])\\.\\.([/\\\\]|$)).+$"
                },
                "line": {
                  "type": "integer",
                  "minimum": 1,
                  "maximum": 1000000
                }
              },
              "required": [
                "path"
              ]
            },
            "maxItems": 30,
            "minItems": 0
          },
          "environment": {
            "type": "string",
            "pattern": "^[a-z][a-z0-9_.-]{0,79}$"
          },
          "sprint": {
            "type": "string",
            "pattern": "^[a-z][a-z0-9_.-]{0,79}$"
          },
          "milestone": {
            "type": "string",
            "pattern": "^[a-z][a-z0-9_.-]{0,79}$"
          },
          "due": {
            "type": "string",
            "pattern": "^\\d{4}-\\d{2}-\\d{2}$"
          },
          "created": {
            "type": "string",
            "pattern": "^\\d{4}-\\d{2}-\\d{2}$"
          },
          "closed": {
            "type": "string",
            "pattern": "^\\d{4}-\\d{2}-\\d{2}$"
          },
          "assignee": {
            "type": "string",
            "minLength": 1,
            "maxLength": 200
          },
          "labels": {
            "type": "array",
            "items": {
              "type": "string",
              "minLength": 1,
              "maxLength": 40
            },
            "maxItems": 20,
            "minItems": 0
          },
          "links": {
            "type": "array",
            "items": {
              "type": "string",
              "maxLength": 2000,
              "pattern": "^https://\\S+$"
            },
            "maxItems": 20,
            "minItems": 0
          },
          "decisionRef": {
            "type": "string",
            "pattern": "^[a-z][a-z0-9_.-]{0,79}$"
          },
          "recipe": {
            "type": "string",
            "pattern": "^[a-z][a-z0-9_.-]{0,79}$"
          },
          "route": {
            "type": "string",
            "pattern": "^[a-z][a-z0-9_.-]{0,79}$"
          }
        },
        "required": [
          "id",
          "type",
          "title",
          "status"
        ]
      },
      "maxItems": 2000,
      "minItems": 0
    }
  },
  "required": [
    "format",
    "version",
    "columns",
    "items"
  ]
}
